<?xml version="1.0" encoding="UTF-8"?>
<!-- Resultat de l'appel https://www.url.com/webSerivice.php 
    avec les parametres en POST suivant:
    usr = 'user.login'
    pwd = 'password'
    op  = 'trouverBureau'
    param0 = 'idPersonne'  // Si la valeur est égal à 0, l'id n'est pas connu.
    param1 = 'nom ou prénom ou les deux' // Valeur pour la recherche d'une personne par une chaine de texte
-->
<response xmlns:xsi="http://www.w3.org/2001/XMLSchema-instance"
    xsi:noNamespaceSchemaLocation="schemaTrouverBureau.xsd">  
    <status>0</status>
    <usrGroup>2</usrGroup>
    <bureaux>
        <bureau longitude="33.864901" latitude="35.564488" etage="3">
            <description value="Test d'une déscription"/>
        </bureau>
        <bureau longitude="33.123455" latitude="35.564488" etage="2">
        </bureau>
        <bureau longitude="33.334444" latitude="35.564488">
        </bureau>
    </bureaux>
</response>
